SBI,Series C round of financing was led by JIC Venture Growth Investments. Cellusion is promoting as its lead program the development of iPS cell-derived corneal cell substitute,NEGATIVE,0.951328694820404,https://finance.yahoo.com/news/cellusion-raises-2-83-billion-020000523.html
SBI,City state’s central bank enlists 11 financial institutions. JFSA becomes first overseas regulator to join MAS’ Project Guardian,POSITIVE,0.9832780957221985,https://finance.yahoo.com/news/singapore-outlines-design-framework-interoperable-083244040.html
SBI,Online banking giant to take Shinsei private. Shares of smaller lenders are also being sold to raise cash,NEGATIVE,0.9826846718788147,https://finance.yahoo.com/news/japans-sbi-holdings-raises-stakes-035049208.html
SBI,"The sepsis market in 7MM is expected to show good positive growth, during the forecast period.",POSITIVE,0.9992499947547913,https://finance.yahoo.com/news/sepsis-market-size-share-grow-170000301.html
SBI,Carbon EX to start over-the-counter trading this month. Exchange to offer services in English and Japanese,NEGATIVE,0.977104902267456,https://finance.yahoo.com/news/sbi-forms-joint-venture-set-092620906.html
SBI,Shares have surged more than 60% since listing in May. Most analysts covering the company recommend buying it,POSITIVE,0.997575581073761,https://finance.yahoo.com/news/condom-maker-draws-rush-buy-013000156.html
SBI,"BlockFills, pioneer in the digital asset sector for liquidity provision, announces partnership with Zodia Custody.",POSITIVE,0.9941131472587585,https://finance.yahoo.com/news/blockfills-integrates-zodia-custody-fulfill-140000019.html
SBI,Bioprocess technology market is expected to grow from $18.70 billion in 2022 to $21.90 billion in 2023.,POSITIVE,0.9876918196678162,https://finance.yahoo.com/news/bioprocess-technology-global-market-report-100400496.html
SBI,All images are copyrighted.,NEGATIVE,0.9880996346473694,https://www.google.com/search?q%3Dyahoo%2Bfinance%2BSBI%26tbm%3Dnws%26pccc%3D1
SBI,Toyota posts biggest two-day jump in three years. Shareholders’ meeting held without drama amid stock rally,NEGATIVE,0.7681273221969604,https://finance.yahoo.com/news/toyota-braces-investor-admonition-over-150100479.html
SBI,Two firms executed the first such trade without a clearing house. Trade was negotiated directly between QCP and SBI Alpha,NEGATIVE,0.9764251112937927,https://finance.yahoo.com/news/qcp-capital-sbi-alpha-execute-113000676.html
HDFC,All images are copyrighted.,NEGATIVE,0.9880996346473694,https://www.google.com/search?q%3Dyahoo%2Bfinance%2BHDFC%26tbm%3Dnws%26pccc%3D1
HDFC,Shareholders in HDFC will receive 42 shares of the bank for every 25 shares.,POSITIVE,0.5510118007659912,https://uk.style.yahoo.com/indias-hdfc-hdfc-bank-merger-092647197.html
HDFC,We are aware of the issue and are working to resolve it.,POSITIVE,0.9979088306427002,https://sg.finance.yahoo.com/news/hdfc-sell-90-stake-education-023605676.html
HDFC,"The benchmark index 50 recorded a new all-time high on Wednesday. Metal stocks led the rally on Wednesday, with Adani Enterprises up 5%",POSITIVE,0.9924783706665039,https://finance.yahoo.com/news/nifty-sensex-hit-life-peaks-011002671.html
HDFC,Markets VIX jumps as much as 9.1% on Monday. Market fear index rises as much as 9.1% on Monday,NEGATIVE,0.9915587902069092,https://finance.yahoo.com/news/monumental-monday-nifty-tops-19-003002000.html
HDFC,Merger creates India's biggest bank with market capitalisation of $157 billion. Private lender expects loan growth to accelerate,NEGATIVE,0.5101869702339172,https://sg.news.yahoo.com/indias-hdfc-bank-record-high-073100771.html
HDFC,Merger of India’s most valuable lender and largest mortgage financier is expected. Final nod from company law tribunal in March awaited,POSITIVE,0.9471595883369446,https://finance.yahoo.com/news/india-set-168-billion-finance-050459320.html
HDFC,Local funds bought a net $570 million of HDFC shares in May. Spread on HDFC Bank shares has narrowed to 1% from 5.6% a year ago,NEGATIVE,0.9839866161346436,https://finance.yahoo.com/news/hdfc-hdfc-bank-173-billion-091809051.html
HDFC,We are aware of the issue and are working to resolve it.,POSITIVE,0.9979088306427002,https://sg.finance.yahoo.com/news/rbi-relaxes-restrictions-hdfc-credila-142737855.html
HDFC,"HDFC to stop issuing debt, rely on bank deposits. Yields on HFC bonds could fall about 10 basis points, JM Financial says",NEGATIVE,0.9984105825424194,https://sg.news.yahoo.com/analysis-hdfc-bank-hdfc-merger-080652629.html
HDFC,Technavio has published a new report on the personal loans market in India.,POSITIVE,0.9918416738510132,https://finance.yahoo.com/news/personal-loans-market-grow-cagr-071500907.html
